{
  "schemaVersion": 2,
  "generatedAt": "2026-07-23T00:00:00Z",
  "apiBaseUrl": "https://ai2m2ia.github.io",
  "apiPrefix": "/api",
  "books": [
    {
      "id": "lets-build-on-aws-together",
      "title": "Let's Build on AWS Together",
      "format": "PROSE",
      "spokeUrl": "https://ai2m2ia.github.io/book-lets-build-on-aws-together/",
      "languages": ["en"],
      "author": "AI(2)M(2)IA",
      "coverUrl": "https://ai2m2ia.github.io/book-lets-build-on-aws-together/assets/cover.svg",
      "description": "When Maya realized her family restaurant was losing orders because the phone was always busy, she didn't know what the cloud meant. Neither did Tom, Leo, or Priya. This book follows their journey from the first EC2 instance to a production-grade AWS infrastructure — teaching every major AWS service through a real startup story. Covers the full AWS SAA-C03 exam curriculum, from cloud fundamentals to Well-Architected senior-level architecture thinking."
    }
  ]
}
